{
  "id": "f3edb3c2-90ca-413c-b6b2-ef3450e9d86d",
  "name": "Hou Yi",
  "subtitle": "Sunbane Marksman",
  "slug": "hou-yi",
  "rarity": 4,
  "description": null,
  "lore": "A half-divine archer, Hou Yi is said to have shot the suns from the sky until only one remained. Whether that tale holds any truth, he has certainly slain countless monsters for the good of Tian. Alas, his many accolades also inflated his ego, making him arrogant, even despotic. The people adore him for his protection, yet fear his growing tyranny.",
  "image_url": "https://yawfmtkrnewpdxjdypmc.supabase.co/storage/v1/object/public/hero-images/4972c0b1-3ed7-4e59-b663-ad807b15053c.webp",
  "image_zoom": 1.5,
  "image_focal_x": 50,
  "image_focal_y": 0,
  "stats": {
    "hp": 18500,
    "acc": 15,
    "atk": 694,
    "def": 1090,
    "res": 65,
    "spd": 92,
    "init": 96,
    "crit_dmg": 50,
    "crit_rate": 10
  },
  "leader_bonus": {
    "text": "50 RES",
    "scope": "Arena"
  },
  "divinity_generator": "Gain [30] Divinity when hit by enemy. Gain an additional [30] Divinity when [Blaze] inflicts damage to this hero.",
  "ascension_bonuses": [
    {
      "tier": 1,
      "bonus": "HP +7%, DEF +7%, ATK +7%"
    },
    {
      "tier": 2,
      "bonus": "HP +7%, DEF +7%, ATK +7%"
    },
    {
      "tier": 3,
      "bonus": "HP +7%, DEF +7%, ATK +7%"
    },
    {
      "tier": 4,
      "bonus": "SPD +5"
    },
    {
      "tier": 5,
      "bonus": "ACC +10"
    },
    {
      "tier": 6,
      "bonus": "Initial Divinity +100"
    }
  ],
  "awakening_bonuses": [
    {
      "tier": 1,
      "bonus": "DMG Reduction Multiplier +10%"
    },
    {
      "tier": 2,
      "bonus": "Heal Multiplier +20%"
    },
    {
      "tier": 3,
      "bonus": "Awaken the ability: Sun Ward"
    },
    {
      "tier": 4,
      "bonus": "Attunement Multiplier +25%, Weapon Multiplier +15%, Armor Multiplier +15%"
    },
    {
      "tier": 5,
      "bonus": "Awaken the ability: Solar Protection"
    }
  ],
  "faction": "Tian",
  "archetype": "Defender",
  "affinity": "Strength",
  "allegiance": "Order",
  "skills": [
    {
      "name": "Sun and Moon",
      "slug": "hou-yi-sun-and-moon",
      "skill_type": "Basic",
      "description": "Attack 1 enemy then place [mechanic:intercept] on the ally with the lowest HP for 1 turn. If Chang'e is on the team, she will join the attack.",
      "image_url": "https://godforge.gg/api/media/file/ICON_HouYi_Basic.webp",
      "scaling_formula": "200%DEF+120%ATK",
      "effects": [
        "DEF Up II"
      ],
      "ultimate_cost": null,
      "initial_divinity": null,
      "awakening_level": null,
      "awakening_bonus": null
    },
    {
      "name": "Solar Protection",
      "slug": "hou-yi-solar-protection",
      "skill_type": "Core",
      "description": "Attack all enemies with a 40% chance to place [mechanic:taunt] for 1 turn. If Chang'e is on the team, place [mechanic:protect-ii] on her for 2 turns.",
      "image_url": "https://godforge.gg/api/media/file/ICON_HouYi_Core.webp",
      "scaling_formula": "180%DEF+110%ATK",
      "effects": [
        "Taunt",
        "Protect II"
      ],
      "ultimate_cost": null,
      "initial_divinity": null,
      "awakening_level": 5,
      "awakening_bonus": "If Chang'e is on the team, place [Protect II] on all allies for 2 turns."
    },
    {
      "name": "Nine Suns Shall Fall",
      "slug": "hou-yi-nine-suns-shall-fall",
      "skill_type": "Ultimate",
      "description": "Remove [mechanic:blaze] from all allies except this hero, then Attack 1 enemy. Has a 75% chance to place [mechanic:atk-down-ii] on all enemies except the target for 2 turns. If there are no other enemies alive, place [mechanic:blunt-ii] on the target for 2 turns.",
      "image_url": "https://godforge.gg/api/media/file/ICON_HouYi_Ultimate.webp",
      "scaling_formula": "210%DEF+120%ATK",
      "effects": [
        "ATK Down II"
      ],
      "ultimate_cost": 1650,
      "initial_divinity": 325,
      "awakening_level": null,
      "awakening_bonus": null
    },
    {
      "name": "Sun Ward",
      "slug": "hou-yi-sun-ward",
      "skill_type": "Passive",
      "description": "When an ally receives [mechanic:blaze], there is a 50% chance this hero receives it instead.",
      "image_url": "https://godforge.gg/api/media/file/ICON_HouYi_Passive.webp",
      "scaling_formula": null,
      "effects": [],
      "ultimate_cost": null,
      "initial_divinity": null,
      "awakening_level": 3,
      "awakening_bonus": "This ability is still under review - please check back later."
    }
  ],
  "imprint_passive": "When an ally receives [Blaze], there is a 25% chance this hero receives it instead."
}