{
  "id": "2f025759-e86c-4d96-b1e7-0188f9dc81f4",
  "name": "Hippolyta",
  "subtitle": "Amazonian Queen",
  "slug": "hippolyta",
  "rarity": 3,
  "description": "Lead your allies to victory whilst defending them against incoming damage.",
  "lore": "The Amazon queen remains faithful to Olympus as a Realm and a pantheon, but her more specific loyalties are being tested. She holds fierce resentment toward Hercules for his actions in the old world. That he has ascended to godhood is infuriating, and that Zeus supported him has caused Hippolyta to question her fealty to the king of the gods as well…",
  "image_url": "https://yawfmtkrnewpdxjdypmc.supabase.co/storage/v1/object/public/hero-images/2f025759-e86c-4d96-b1e7-0188f9dc81f4.webp",
  "image_zoom": 1.5,
  "image_focal_x": 50,
  "image_focal_y": 0,
  "stats": {
    "hp": 14866,
    "acc": 10,
    "atk": 584,
    "def": 903,
    "res": 45,
    "spd": 84,
    "init": 86,
    "crit_dmg": 50,
    "crit_rate": 10
  },
  "leader_bonus": {
    "text": "16% DEF",
    "scope": "All Battles"
  },
  "divinity_generator": "Gain [20] Divinity when hit by an enemy.",
  "ascension_bonuses": [
    {
      "tier": 1,
      "bonus": "HP +5%, ATK +5%, DEF +5%"
    },
    {
      "tier": 2,
      "bonus": "HP +5%, ATK +5%, DEF +5%"
    },
    {
      "tier": 3,
      "bonus": "HP +5%, ATK +5%, DEF +5%"
    },
    {
      "tier": 4,
      "bonus": "SPD +3"
    },
    {
      "tier": 5,
      "bonus": "INIT +3"
    },
    {
      "tier": 6,
      "bonus": "Initial Divinity +50"
    }
  ],
  "awakening_bonuses": [
    {
      "tier": 1,
      "bonus": "Shield Multiplier +5%"
    },
    {
      "tier": 2,
      "bonus": "Attunement Multiplier +5%, Armor Multiplier +2.5%, Weapon Multiplier +2.5%"
    },
    {
      "tier": 3,
      "bonus": "Shield Multiplier +5%"
    },
    {
      "tier": 4,
      "bonus": "Attunement Multiplier +5%, Armor Multiplier +2.5%, Weapon Multiplier +2.5%"
    },
    {
      "tier": 5,
      "bonus": "Awaken the ability: Tip of the Spear"
    }
  ],
  "faction": "Olympus",
  "archetype": "Defender",
  "affinity": "Cunning",
  "allegiance": "Order",
  "skills": [
    {
      "name": "Stalwart Thrust",
      "slug": "hippolyta-stalwart-thrust",
      "skill_type": "Basic",
      "description": "Attack 1 enemy (200%DEF+75%ATK). Increase this hero’s DEF by 2% (stacking up to 5 times)",
      "image_url": "https://godforge.gg/api/media/file/ICON_Hippolyta_Basic.webp",
      "scaling_formula": "200%DEF+75%ATK",
      "effects": [
        "DEF Up I"
      ],
      "ultimate_cost": null,
      "initial_divinity": null,
      "awakening_level": null,
      "awakening_bonus": null
    },
    {
      "name": "Amazonian Tactics",
      "slug": "hippolyta-amazonian-tactics",
      "skill_type": "Core",
      "description": "Place [mechanic:shield]15%HP on all allies. Also place [mechanic:spd-up-i] on all allies from Olympus for 2 turns.",
      "image_url": "https://godforge.gg/api/media/file/ICON_Hippolyta_Core.webp",
      "scaling_formula": "15%HP",
      "effects": [
        "Shield",
        "Ward",
        "SPD Up I"
      ],
      "ultimate_cost": null,
      "initial_divinity": null,
      "awakening_level": null,
      "awakening_bonus": null
    },
    {
      "name": "Tip of the Spear",
      "slug": "hippolyta-tip-of-the-spear",
      "skill_type": "Ultimate",
      "description": "Attack 1 enemy (225%DEF+95%ATK) with 1 random ally joining the attack.",
      "image_url": "https://godforge.gg/api/media/file/ICON_Hippolyta_Ultimate.webp",
      "scaling_formula": "225%DEF+95%ATK",
      "effects": [],
      "ultimate_cost": 1100,
      "initial_divinity": 325,
      "awakening_level": 5,
      "awakening_bonus": "Allies from Olympus also join the attack."
    },
    {
      "name": "Strength in Union",
      "slug": "hippolyta-strength-in-union",
      "skill_type": "Passive",
      "description": "Increases the DEF of all allies by 3% for each hero matching this hero’s realm.",
      "image_url": "https://godforge.gg/api/media/file/ICON_Hippolyta_Passive.webp",
      "scaling_formula": null,
      "effects": [],
      "ultimate_cost": null,
      "initial_divinity": null,
      "awakening_level": null,
      "awakening_bonus": null
    }
  ],
  "imprint_passive": "Increases the DEF of all allies by 1.5% for each hero matching this hero’s realm."
}