{
  "id": "306943e5-eb84-4676-90d9-8155b88e2de4",
  "name": "Muse",
  "subtitle": "Font of Inspiration",
  "slug": "muse",
  "rarity": 3,
  "description": "Invoker that can gain power and spread it among her allies.",
  "lore": "The muses are the font of inspiration for poets, musicians, and artists throughout Olympus. In the old world, violence was alien to these lesser gods, but in Ryven even they must defend themselves. Muses prefer to spur others to fight for them, but when that proves insufficient, they have learned to raise arms, for even combat is its own form of art.",
  "image_url": "https://yawfmtkrnewpdxjdypmc.supabase.co/storage/v1/object/public/hero-images/306943e5-eb84-4676-90d9-8155b88e2de4.webp",
  "image_zoom": 1.5,
  "image_focal_x": 50,
  "image_focal_y": 0,
  "stats": {
    "hp": 13710,
    "acc": 5,
    "atk": 650,
    "def": 848,
    "res": 25,
    "spd": 98,
    "init": 90,
    "crit_dmg": 50,
    "crit_rate": 10
  },
  "leader_bonus": {
    "text": "A  powerful attack planned for the future."
  },
  "divinity_generator": "This ability is still under review - please check back later.",
  "ascension_bonuses": [
    {
      "tier": 1,
      "bonus": "HP +5%, ATK +5%, DEF +5%"
    },
    {
      "tier": 2,
      "bonus": "HP +5%, ATK +5%, DEF +5%"
    },
    {
      "tier": 3,
      "bonus": "HP +5%, ATK +5%, DEF +5%"
    },
    {
      "tier": 4,
      "bonus": "ACC +7"
    },
    {
      "tier": 5,
      "bonus": "INIT +3"
    },
    {
      "tier": 6,
      "bonus": "Initial Divinity +50"
    }
  ],
  "awakening_bonuses": [
    {
      "tier": 1,
      "bonus": "Turn Meter Multiplier +2.5%"
    },
    {
      "tier": 2,
      "bonus": "Attunement Multiplier +5%, Armor Multiplier +2.5%, Weapon Multiplier +2.5%"
    },
    {
      "tier": 3,
      "bonus": "Turn Meter Multiplier +2.5%"
    },
    {
      "tier": 4,
      "bonus": "Attunement Multiplier +5%, Armor Multiplier +2.5%, Weapon Multiplier +2.5%"
    },
    {
      "tier": 5,
      "bonus": "Awaken the ability: Melody Infusion"
    }
  ],
  "faction": "Olympus",
  "archetype": "Invoker",
  "affinity": "Wisdom",
  "allegiance": "Chaos",
  "skills": [
    {
      "name": "Ethereal Amplification",
      "slug": "muse-ethereal-amplification",
      "skill_type": "Core",
      "description": "This ability is still under review - please check back later.",
      "image_url": "https://godforge.gg/api/media/file/ICON_Muse_Core.webp",
      "scaling_formula": null,
      "effects": [],
      "ultimate_cost": null,
      "initial_divinity": null,
      "awakening_level": null,
      "awakening_bonus": null
    },
    {
      "name": "Poetic Resonance",
      "slug": "muse-poetic-resonance",
      "skill_type": "Passive",
      "description": "This ability is still under review - please check back later.",
      "image_url": "https://godforge.gg/api/media/file/ICON_Muse_Passive.webp",
      "scaling_formula": null,
      "effects": [],
      "ultimate_cost": null,
      "initial_divinity": null,
      "awakening_level": null,
      "awakening_bonus": null
    },
    {
      "name": "Melody Infusion",
      "slug": "muse-melody-infusion",
      "skill_type": "Basic",
      "description": "This ability is still under review - please check back later.",
      "image_url": "https://godforge.gg/api/media/file/ICON_Muse_Basic.webp",
      "scaling_formula": null,
      "effects": [],
      "ultimate_cost": null,
      "initial_divinity": null,
      "awakening_level": 5,
      "awakening_bonus": "This ability is still under review - please check back later."
    },
    {
      "name": "Clarion Call",
      "slug": "muse-clarion-call",
      "skill_type": "Ultimate",
      "description": "This ability is still under review - please check back later.",
      "image_url": "https://godforge.gg/api/media/file/ICON_Muse_Ultimate.webp",
      "scaling_formula": null,
      "effects": [],
      "ultimate_cost": null,
      "initial_divinity": null,
      "awakening_level": null,
      "awakening_bonus": null
    }
  ],
  "imprint_passive": "This ability is still under review - please check back later."
}